{
  "schema": "JAH-MUSIC-MANIFEST/1.0",
  "site": "Signature Music Studio",
  "site_number": 23,
  "network": "THE JAH NETWORK \u2014 27 sites",
  "generated_at": "2026-10-14T00:41:05.833585+00:00",
  "archive": {
    "songs": 60700,
    "library_sounds": 60450,
    "equipment": 350,
    "beats": 30250,
    "total": 151750,
    "goals": {
      "songs": 1000000,
      "library_sounds": 1000000
    },
    "id_ranges": {
      "song": {
        "first": "JAH-SONG-0000001",
        "last": "JAH-SONG-0060700",
        "count": 60700
      },
      "sound": {
        "first": "JAH-SOUND-0000001",
        "last": "JAH-SOUND-0060450",
        "count": 60450
      },
      "gear": {
        "first": "JAH-GEAR-0000001",
        "last": "JAH-GEAR-0000350",
        "count": 350
      },
      "beat": {
        "first": "JAH-BEAT-0000001",
        "last": "JAH-BEAT-0030250",
        "count": 30250
      }
    }
  },
  "engine": {
    "name": "Signature Music Engine",
    "version": "SIGMUSIC-V1",
    "seed_algorithm": "xmur3 (hashSeed) feeding mulberry32 (rngFrom) \u2014 'songtheme:<theme>' -> n = 1 + hashSeed('songtheme:<theme>') % 1000000",
    "determinism": "same request + same engine version + same voice version = same composition (structure, chords, melody, lyrics) and same rendered WAV bytes (all randomness seeded, incl. the noise floor)",
    "sound_library_version": "SIGSOUND-V1"
  },
  "voices": [
    {
      "id": "JAH-VOICE-000001",
      "name": "Nova",
      "version": "v1",
      "kind": "synthesized soprano"
    },
    {
      "id": "JAH-VOICE-000002",
      "name": "Ember",
      "version": "v1",
      "kind": "synthesized alto"
    },
    {
      "id": "JAH-VOICE-000003",
      "name": "Drift",
      "version": "v1",
      "kind": "synthesized tenor"
    },
    {
      "id": "JAH-VOICE-000004",
      "name": "Stone",
      "version": "v1",
      "kind": "synthesized bass"
    }
  ],
  "voices_note": "All voices are synthesized. There are no human singers on this site \u2014 no exceptions.",
  "index": {
    "file": "data/index/index.json.gz",
    "records": 151750,
    "sha256": "a145801c22f60b135215387fb068f70b776af7af794f647ff95c034609108080",
    "row_format": [
      "id",
      "title",
      "kind",
      "chunk"
    ],
    "chunk_pointers_verified": true
  },
  "id_schemes": {
    "song": "JAH-SONG-%07d (7-digit, permanent, never reused)",
    "beat": "JAH-BEAT-%07d (7-digit, permanent, never reused)",
    "sound": "JAH-SOUND-%07d (7-digit, permanent, never reused)",
    "equipment": "JAH-GEAR-%07d (7-digit, permanent, never reused)",
    "voice": "JAH-VOICE-%06d (6-digit, permanent, never reused)",
    "project": "JAH-PROJECT-%07d (reserved \u2014 user projects)",
    "cd": "JAH-CD-%07d (reserved \u2014 CD records)",
    "mix": "JAH-MIX-%07d (reserved \u2014 mix records)",
    "cleanup": "JAH-CLEANUP-%07d (reserved \u2014 vocal cleanup records)",
    "patch": "JAH-PATCH-%07d (reserved \u2014 patch records)"
  },
  "deep_links": {
    "song": "?song=JAH-SONG-0000001",
    "sound": "?sound=JAH-SOUND-0000001",
    "gear": "?gear=JAH-GEAR-0000001",
    "beat": "?beat=JAH-BEAT-0000001"
  },
  "provenance": {
    "generated_by": "code/drip.py + code/seed.py (deterministic node driver over assets/engine.js)",
    "composition_stable": "song spec (notes/chords/lyrics/structure) is stable even if the render engine improves",
    "audio_synthesis": "All audio synthesized client-side with the Web Audio API \u2014 no samples, no human singers"
  }
}